{
  "$schema": "https://json-schema.org/draft/2020-12/schema",
  "$id": "https://bughuntskills.example/schemas/broker-policy-v1.json",
  "title": "BugHuntSkills Authentication Broker Policy v1",
  "type": "object",
  "properties": {
    "schemaVersion": {
      "type": "number",
      "const": 1
    },
    "engagementId": {
      "type": "string",
      "pattern": "^[a-zA-Z0-9][a-zA-Z0-9._-]{2,127}$"
    },
    "policySnapshot": {
      "type": "object",
      "properties": {
        "url": {
          "type": "string",
          "minLength": 1,
          "maxLength": 2048
        },
        "revision": {
          "type": "string",
          "minLength": 1,
          "maxLength": 128
        },
        "capturedAtUtc": {
          "type": "string",
          "pattern": "^\\d{4}-\\d{2}-\\d{2}T\\d{2}:\\d{2}:\\d{2}(?:\\.\\d{1,3})?Z$"
        },
        "freshUntilUtc": {
          "type": "string",
          "pattern": "^\\d{4}-\\d{2}-\\d{2}T\\d{2}:\\d{2}:\\d{2}(?:\\.\\d{1,3})?Z$"
        }
      },
      "required": [
        "url",
        "revision",
        "capturedAtUtc",
        "freshUntilUtc"
      ],
      "additionalProperties": false
    },
    "accountAliases": {
      "minItems": 1,
      "maxItems": 32,
      "type": "array",
      "items": {
        "type": "string",
        "pattern": "^[a-z0-9][a-z0-9._-]{0,63}$"
      }
    },
    "loginOrigins": {
      "maxItems": 32,
      "type": "array",
      "items": {
        "type": "object",
        "properties": {
          "origin": {
            "type": "string",
            "minLength": 1,
            "maxLength": 2048
          },
          "purpose": {
            "type": "string",
            "const": "user-attended sign-in only"
          }
        },
        "required": [
          "origin",
          "purpose"
        ],
        "additionalProperties": false
      }
    },
    "refreshOrigins": {
      "maxItems": 16,
      "type": "array",
      "items": {
        "type": "object",
        "properties": {
          "origin": {
            "type": "string",
            "minLength": 1,
            "maxLength": 2048
          },
          "methods": {
            "minItems": 1,
            "maxItems": 7,
            "type": "array",
            "items": {
              "type": "string",
              "enum": [
                "GET",
                "HEAD",
                "POST",
                "PUT",
                "PATCH",
                "DELETE",
                "OPTIONS"
              ]
            }
          },
          "policyReference": {
            "type": "string",
            "minLength": 1,
            "maxLength": 512
          }
        },
        "required": [
          "origin",
          "methods",
          "policyReference"
        ],
        "additionalProperties": false
      }
    },
    "targetOrigins": {
      "minItems": 1,
      "maxItems": 64,
      "type": "array",
      "items": {
        "type": "string",
        "minLength": 1,
        "maxLength": 2048
      }
    },
    "grants": {
      "minItems": 1,
      "maxItems": 256,
      "type": "array",
      "items": {
        "type": "object",
        "properties": {
          "accountAlias": {
            "type": "string",
            "pattern": "^[a-z0-9][a-z0-9._-]{0,63}$"
          },
          "technique": {
            "type": "string",
            "minLength": 1,
            "maxLength": 128
          },
          "methods": {
            "minItems": 1,
            "maxItems": 7,
            "type": "array",
            "items": {
              "type": "string",
              "enum": [
                "GET",
                "HEAD",
                "POST",
                "PUT",
                "PATCH",
                "DELETE",
                "OPTIONS"
              ]
            }
          },
          "policyReference": {
            "type": "string",
            "minLength": 1,
            "maxLength": 512
          }
        },
        "required": [
          "accountAlias",
          "technique",
          "methods",
          "policyReference"
        ],
        "additionalProperties": false
      }
    },
    "limits": {
      "type": "object",
      "properties": {
        "requestsPerSecond": {
          "type": "number",
          "exclusiveMinimum": 0,
          "maximum": 1
        },
        "maxConcurrentRequests": {
          "type": "integer",
          "exclusiveMinimum": 0,
          "maximum": 1
        },
        "maxRequestsPerCapability": {
          "type": "integer",
          "exclusiveMinimum": 0,
          "maximum": 100
        },
        "maxRequestBodyBytes": {
          "type": "integer",
          "minimum": 0,
          "maximum": 65536
        },
        "expiresAtUtc": {
          "type": "string",
          "pattern": "^\\d{4}-\\d{2}-\\d{2}T\\d{2}:\\d{2}:\\d{2}(?:\\.\\d{1,3})?Z$"
        }
      },
      "required": [
        "requestsPerSecond",
        "maxConcurrentRequests",
        "maxRequestsPerCapability",
        "maxRequestBodyBytes",
        "expiresAtUtc"
      ],
      "additionalProperties": false
    },
    "stopConditions": {
      "minItems": 1,
      "maxItems": 64,
      "type": "array",
      "items": {
        "type": "string",
        "minLength": 1,
        "maxLength": 256
      }
    }
  },
  "required": [
    "schemaVersion",
    "engagementId",
    "policySnapshot",
    "accountAliases",
    "loginOrigins",
    "refreshOrigins",
    "targetOrigins",
    "grants",
    "limits",
    "stopConditions"
  ],
  "additionalProperties": false
}
